Speaker	Title	Content
Blake Sirgo	Senior Vice President of Operations at Cabot Oil & Gas	Yes, just to echo Tom, we do have options to grow our gas volumes there. There is the pipeline space. It might come with a little higher cost than our current differentials. So that would be something that would have to go into the discussion. As far as rig and fracs, you just got to stay ahead of it. It's not something we could knee jerk, but we could get the crews and rigs as long as we play out in time.
Michael Scialla	Analyst at Stephens	Appreciate that. And I wanted to ask on the Upper Marcellus. We've talked about delineations there. When you look at your 529 Upper Marcellus locations that you had in inventory at the end of the year, if the delineation works, I guess, what would be the impact on the number? Are you talking about potentially like doubling the inventory? Or is it modest increase? I'm just looking for some sense of what delineation could mean for the inventory?
Thomas Jorden	Chairman, President & Chief Executive Officer at Cabot Oil & Gas	No, that inventory is really with our current acreage footprint. We are back to leasing in the Marcellus and filling in that acreage footprint. And our team in Pittsburgh has done a really nice job of that. But that is with our current model of spacing, with our current acreage. So that's what -- that's the number.
Michael Scialla	Analyst at Stephens	Got it. Thank you.
Operator	Operator	Your next question comes from the line of Neal Dingmann from Truist Securities. Your line is open.
Neal Dingmann	Analyst at Truist Securities	Good morning, thanks for taking my question. First is on, I guess, an M&A-type question specifically. I'm just wondering could you discuss opportunities to sort of trade and block up your Delaware acreage specifically in New Mexico, where it looks like you have a little bit more scattered position there?
Thomas Jorden	Chairman, President & Chief Executive Officer at Cabot Oil & Gas	Well, New Mexico is a tough fair walk up. The ownership is like a quilt work patch. There are some assets on the market that we've looked at. But even at today's prices, it's being -- assets are marketed at full retail. And we're going to be very cautious on M&A. With our balance sheet and our organizational capacity, we would love to find a transaction that adds value to our owners and it increases our opportunity for operations. Quite frankly, a lot of the assets out there have peaked production. They've really drilled to increase production over the short run and have rather short inventory behind that. And that doesn't do much for us. We've also traded and done a lot of swaps to increase our ability to block up our drilling spacing units and have long laterals. So there's a lot of that type of activity. That's the benefit of us and the operators we trade with. But we look at everything. We're very active in that market, but we're going to be really cautious and preserve value for our shareholders.
Neal Dingmann	Analyst at Truist Securities	Yes. Like your strategic nature, Tom, it's always paid dividends. My second question, maybe just sticking with Del [Phonetic]. Could you give me an idea of sort of -- I know you mentioned or you or Scott mentioned six rigs likely to continue active on the Del this year. Could you remind me kind of what area that will focus? And as a result, really any notable change in the GOR this year versus last?
Thomas Jorden	Chairman, President & Chief Executive Officer at Cabot Oil & Gas	No. That tends to move around depending on the nature of the program, where we're permitted. This year, looking ahead, we're heavily in reach. We're heavy in Culberson. Eddie is a lower share. Lake County is still very active. It's in our deck, our breakdown of where our activity is. But it does tend to ebb and flow. But you're probably going to see the majority of it on any given year and being ready for [indecipherable] just because of their [Phonetic] say of Texas, the time line between project inception and moving dirt is pretty short, whereas you get into Mexico, you have state and federal permit constraints and it's just not as nimble, but it's going to happen flow.
Neal Dingmann	Analyst at Truist Securities	Very good. Thank you, Tom.
Operator	Operator	[Operator Instructions] Your next question comes from the line of David Deckelbaum from TD Cowen. Your line is open.
David Deckelbaum	Analyst at TD Cowen	Good morning, gentleman. Scott, thanks for your time today. I was curious -- I wanted to ask a bit -- I don't know if my eyes are just playing tricks on me, but when I look at presentations, are you including greater activity at this point for the Harkey zones? And I guess you didn't touch on that specifically I guess, with this presentation, but can you update us on how the Harkey performance is relative to sort of the other programs in Culberson? And how you're thinking about that zone? And perhaps the more challenged commodity environment today?
Thomas Jorden	Chairman, President & Chief Executive Officer at Cabot Oil & Gas	Well, we love the Harkey. I'll say the Harkey, like many, is highly variable. It's not a one size fits all. So around the basin, it's going to vary. But in a lot of our position, it's highly and competes very nicely with Wolfcamp. We've very active in the Harkey as you can look at our Slide 12. We've got a lot of Harkey in our program. I think we'll continue with that. And it depends on where you are. There's places where it's right on top of the Wolfcamp. There's places where it's a little lower than the Wolfcamp, but it's one of the best landing zones in the basin. I'll say that flat out.
David Deckelbaum	Analyst at TD Cowen	I appreciate the color there. It doesn't sound like necessarily a composition has shifted from quarter-to-quarter, per se, though.
Thomas Jorden	Chairman, President & Chief Executive Officer at Cabot Oil & Gas	No, no.
David Deckelbaum	Analyst at TD Cowen	Okay. Shifting just to the Marcellus briefly, just to revisit lateral length progression over the next several years. The upper obviously, has a greater weight, I think, and I think you all said in the '23 program versus what you expect to do in '24, '25. Should we expect that future upper wells that are in the program in '24, '25 are still in that, call it, 11,500-foot range? Or how do you think about the average lateral length for the upper versus the lower in the next few years?
Thomas Jorden	Chairman, President & Chief Executive Officer at Cabot Oil & Gas	Well, the average lateral length in the upper is going to be on the longer end of that. The upper is fairly wide open. So I think you're looking at average lateral lengths, they're going to be 10,000 to 15,000 feet, probably closer to the lower end of that, depending on what our units look like. So a lot of the average lateral length of the Marcellus program is really a combination or a function of the upper versus lower mix. As we fill out the lower, we're going to have shorter lateral lengths because we're filling in islands that are undeveloped. Yes, hopefully, that answers your question.
David Deckelbaum	Analyst at TD Cowen	Yes, appreciate that. Thanks, Tom.
Operator	Operator	And there are no further questions at this time. Mr. Tom Jorden. I will now turn the call back over to you for some final closing remarks.
Thomas Jorden	Chairman, President & Chief Executive Officer at Cabot Oil & Gas	Thank you all for joining us. It's nice to generate and discuss great results. We've always been a team that likes to talk about results more than promises, and I look forward to continuing to talk about results as time marches on. Thank you very much.
Operator	Operator	[Operator Closing Remarks]
