Speaker	Title	Content
Operator	Operator	Welcome to the First Quarter 2023 Stanley Black & Decker Earnings Conference Call. My name is Shannon, and I will be your operator for today's call. At this time, all participants are in a listen-only mode. Later, we will conduct a question-and-answer session. Please note that this conference is being recorded.
Operator	Operator	I will now turn the call over to the Vice President of Investor Relations, Dennis Lange. Mr. Lange, you may begin.
Dennis Lange	Vice President-Investor Relations at Stanley Black & Decker	Thank you, Shannon. Good morning, everyone, and thanks for joining us for Stanley Black & Decker's 2023 First Quarter Webcast. On the webcast in addition to myself, Don Allan, President and CEO; and Pat Hallinan, Executive Vice President and CFO. Our earnings release, which was issued earlier this morning and the supplemental presentation, which we will refer to, are available on the IR section of our website. A replay of this morning's webcast will also be available beginning at 11 a.m. today.
Dennis Lange	Vice President-Investor Relations at Stanley Black & Decker	This morning, Don and Pat will review our 2023 first quarter year results and various other matters followed by a Q&A session. Consistent with prior webcast, we are going to be sticking with just one question per caller. And as we normally do, we will be making some forward-looking statements during the call based on our current views.
Dennis Lange	Vice President-Investor Relations at Stanley Black & Decker	Such statements are based on assumptions of future events that may not prove to be accurate and, as such, involve risk and uncertainty. It's therefore possible that the actual results may materially differ from any forward-looking statements that we may make today. We direct you to the cautionary statements in the 8-K that we filed with our press release and in our most recent 34-F filing.
Dennis Lange	Vice President-Investor Relations at Stanley Black & Decker	I'll now turn the call over to our President and CEO, Don Allan.
Don Allan	President & Chief Executive Officer at Stanley Black & Decker	Thank you Dennis and good morning everyone. Before we begin, I am extremely pleased to have Patrick Hallinan on board and joining our call today as Stanley Black & Decker's newly appointed Chief Financial Officer. Pat brings to the team a deep track record of delivering business performance, growth and value creation and complex competitive consumer-branded businesses. Following my remarks, Pat will take you through the financial highlights as well as our current outlook. Welcome Pat.
Don Allan	President & Chief Executive Officer at Stanley Black & Decker	Earlier this week we also announced that Chris Nelson will be joining the company in mid-June as Chief Operating Officer and Executive Vice President and President of Tools and Outdoor. Chris is an experienced global leader with exceptional industry knowledge and existing relationships with many of our customers. His track record of success implementing growth strategies which have delivered customer-centric innovation and profitable market share expansion make him the ideal leader for our tools and outdoor business. I look forward to partnering with Pat, Chris and the entire leadership team to streamline and optimize the company around our core businesses and strong portfolio of global brands as we execute our strategy and generate sustainable growth.
Don Allan	President & Chief Executive Officer at Stanley Black & Decker	In terms of our Q1 performance we continue to build momentum and make strong progress as the organization remains focused on our business transformation plan. We took additional steps forward in the quarter to better serve our customers and deliver for key stakeholders by reducing inventory, leveraging enhanced cost controls and optimizing our global supply chain while continuing to increase our investments in innovation and end-user activation. The global cost reduction program delivered $230 million in pre-tax run rate savings this quarter which is modestly ahead of plan. Since we launched the program we've captured a total of $430 million of annualized savings. This is a great start and we believe we are on track to achieve the expected $1 billion of total program run rate savings by year end.
Don Allan	President & Chief Executive Officer at Stanley Black & Decker	Inventory reduction is also ahead of plan with incremental $200 million improvement in the quarter. Even while we strategically build inventory in some categories to prepare for the upcoming outdoor and Father's Day merchandising season, we have now reduced approximately $1 billion of inventory since mid-2022. I am encouraged by our progress thus far and I am confident that by executing our strategy we are positioning the company for a strong long-term growth, cash flow generation, profitability and shareholder return.
Don Allan	President & Chief Executive Officer at Stanley Black & Decker	Our first quarter revenue of $3.9 billion was in line with Q4 2022. This was down versus prior year as price realization and solid industrial and professional construction demand was more than offset by lower consumer and DIY volume, currency and the oil and gas business divestiture.
Don Allan	President & Chief Executive Officer at Stanley Black & Decker	Let me now provide some perspective on end market demand. The U.S. retail point of sale for our tools and outdoor products remained in a growth position this quarter versus 2019 levels bolstered by price and healthy pro demand. The outdoor season had a slow start in March but April weekly point of sale trends have been encouraging. Adjusted gross margin for the quarter was 23.1% up 360 basis points sequentially versus Q4 2022. While there still is more work to be done, we are seeing adjusted gross margin improve as destocking impacts moderate.
Don Allan	President & Chief Executive Officer at Stanley Black & Decker	Adjusted EPS for the period was a loss of $0.41 significantly impacted by our plan prioritization efforts around inventory reduction. We are committed to advancing our business transformation plan and continuing our journey forward with persistent focus on what is within our control. We are monitoring the demand environment and global economic dynamics and planning for a range of outcomes which balance the potential continuation of the current trends with the possibility of improvement as well as the prospect of a further demand slowdown. We have planned for all three of these scenarios and will respond accordingly if we see current trends shift. We are reiterating our 2023 full year adjusted diluted EPS guidance range of zero to $2 as well as our free cash flow guidance of $500 million to $1 billion. Pat will provide more color on this later in our presentation.
Don Allan	President & Chief Executive Officer at Stanley Black & Decker	As we generate cost savings, we are continuing to make strategic investments in our iconic brands, innovation engine, electrification and commercialization activation to position the business for sustainable growth and margin expansion. This includes hiring additional engineers focused on product platforming, electrification and innovation as well as speed on the street to elevate user activation activities which will ensure we extend the leadership positions of these iconic brands. Our priorities in 2023 remain unchanged. One, strong focus on cash flow through inventory reduction to assist with on-going debt deleveraging. Two, sequential improvement in our adjusted gross margin as we drive further supply chain transformation initiatives. Three, get back to gaining market share in all major categories of our Tools & Outdoor business. Successfully executing these priorities will result in a stronger balance sheet and significantly improved EBITDA in the second half of 2023 as we head into 2024.
Don Allan	President & Chief Executive Officer at Stanley Black & Decker	Now let me walk through the details of our business segment performance. Beginning with tools and outdoor. Revenue was $3.3 billion, a decline of 13% as price realization was more than offset by decline in volume and a negative impact from currency. Volume was impacted by lower consumer and DIY market demand modestly reduced channel inventory and a slow start to the retail outdoor season due to a cold March with temperatures well below the 5-year average.
Don Allan	President & Chief Executive Officer at Stanley Black & Decker	Tools & Outdoor adjusted operating margin was 3% down versus the prior year as price realization was more than offset by inflation, higher supply chain cost, production curtailment and lower volume. North America and Europe were both down 12% organically as both reasons were impacted by the factors covered for the overall segment. Emerging markets were down 2% organically, but excluding the impacts from our Russian business access the region had 6% organic growth. This was led by strength in Brazil, China and the Middle East.
Don Allan	President & Chief Executive Officer at Stanley Black & Decker	Moving to our strategic business unit performance, power tools and hand tools were primarily impacted by softer consumer demand declining organically 12% and 6% respectively. The Outdoor business declined 16% organically, largely impacted by softer consumer demand and the cooler weather. The slow start to the season pressured our outdoor results versus planned by approximately 5 to 6 points. We are monitoring demand to determine if this could be potentially recaptured in 2023 with encouraging POS in recent weeks signalling the season is now ramping up.
Don Allan	President & Chief Executive Officer at Stanley Black & Decker	A key growth area for outdoor is leveraging the 2500 Pro dealers that we acquired with our acquisition. This channel delivered a strong performance in the quarter and was up double-digits year-over-year. Pro products under our Cub Cadet and Hustler brands had a solid start and we are building traction with our DEWALT cordless handheld products across the dealer network.
Don Allan	President & Chief Executive Officer at Stanley Black & Decker	Now shifting to our industrial business, which had 3% organic growth in the quarter with double-digit operating margin. Total segment revenue declined 5% versus 2022 as price realization was more than offset by last year's oil & gas divestiture, currency and volume. The team leveraged price realization and productivity to deliver adjusted operating margin of 11% up 410 basis points versus the prior year.
Don Allan	President & Chief Executive Officer at Stanley Black & Decker	Within this segment Engineered Fastening organic revenues were up 3% led by aerospace growth of 30% and auto growth of 7% offset by softer industrial market.
Don Allan	President & Chief Executive Officer at Stanley Black & Decker	Attachment tools organic revenues were up 5%, driven by strategic pricing actions and continued conversion of this businesses significant backlog. In summary, this was a job well done across the board of our team we continue to reduce inventory and drove improved gross margin in a mixed revenue environment. My thanks to the entire team as we maintained our focus on the right areas and we are seeing the results of our efforts.
Don Allan	President & Chief Executive Officer at Stanley Black & Decker	On the next slide, I would like to review our long-term strategy that we launched last July as we transformed Stanley Black & Decker to drive consistent organic growth at accelerated levels well above market growth. Our teams around the world are gaining traction and executing on our primary areas of focus. One, streamlining and simplifying the organisation as well as shifting resources to prioritise investment that we believe have a positive and more direct impact for our customers and end users.
Don Allan	President & Chief Executive Officer at Stanley Black & Decker	Two, accelerating the operations and supply chain transformation to return adjusted gross margins to historical 35% plus level while improving fill rate to better match inventory with custom advance. Three, prioritizing cash flow generation and inventory optimization and four, continuing to advance innovation, electrification and global market penetration to achieve organic growth of two to three times the market. Our business transformation remains on track to deliver on these financial commitments as we strive to elevate our customer and end user experiences to world class level.
Don Allan	President & Chief Executive Officer at Stanley Black & Decker	The streamlining of our company and the supply chain initiatives are tracking to expectations and continuing to gain momentum. The four value creation streams within our supply chain transformation strategy are advancing with meaningful strides forward and a $110 million of savings achieved in the first quarter. Our global team is activating against our strategy with speed.
Don Allan	President & Chief Executive Officer at Stanley Black & Decker	The energy and passion is evident and I'd like to extend my sincere thanks to our operations associates across the globe. We have made so much progress in the last nine months and every completed milestone is contributing to our shared vision for the supply chain of the future.
Don Allan	President & Chief Executive Officer at Stanley Black & Decker	Now a few updates in this particular area. Within the few rationalization and product platforming value stream we have approved the reduction of 60,000 SKUs across the portfolio of which 16,000 are now decommissioned. The remaining balance is no longer being manufactured and we are working with our customers to transition to new SKUs in the coming quarters.
Don Allan	President & Chief Executive Officer at Stanley Black & Decker	Strategic sourcing has been a strong contributor to savings as we complete the $2 billion first tranche of spend assessment. We are on track to achieve the targeted savings. Our supply base will include both existing and new vendors with a deliberate intent to improve geographic diversification and consolidation.
Don Allan	President & Chief Executive Officer at Stanley Black & Decker	Our dedicated team is capturing cost savings while deploying new processes to ensure sourcing changes are executed successfully. Our initial announcements related to the manufacturing footprint optimization were made in March, which includes site expansions, transformations into manufacturing centers of excellence as well as site consolidation. We are on track with our expectations and are taking a holistic approach to our manufacturing base and logistics network to ensure we optimize the efficiency and utilization of our asset base. Finally, we are increasing our focus on manufacturing excellence and re-emphasizing the SBD operating model along with lean manufacturing practices at our factories. We deployed this playbook at four plants in the first quarter and in March we kicked off at nine additional sites. We are seeing strong traction and are capturing improved productivity efficiencies where these tools were activated. We are excited with the progress and you can expect us to continue to make strides in the coming months and quarters.
Don Allan	President & Chief Executive Officer at Stanley Black & Decker	Turning to SG&A, we captured approximately $120 million of savings this quarter and are on pace for $500 million of pre-tax savings by the end of the year from simplifying the corporate structure, streamlining leadership spans of control and organizational layers, and reducing indirect spend. We are confident in our ability to capture $1 billion of run rate savings by the end of 2023 and $2 billion of annualized savings by 2025 from this program. A key tenet of our strategy is the acceleration of investment in innovation and electrification. We are making deliberate strategic investments to maintain our market-leading innovation ecosystem. A couple highlights from this year's outdoor season. In terms of delivering innovative cordless products, the CRAFTSMAN 20-volt line-up is designed for extended runtime and better performance. This includes the new brushless string trimmer that is lighter weight than its gas-powered equivalent and carries more runtime and force than prior generations. The new cordless pressure washer also joins this line-up in addition to the range of other new 20-volt cordless lawn and garden tools. Continuing to expand our 20-volt system is enabling users to go wherever the work is without the limitation of cords or gas engines. These items are currently available for this season and we are excited about the initial market reception. Additionally, we just received notice that we won eight 2023 Popular Mechanics Yard and Garden Best New Product Awards across DEWALT, CRAFTSMAN, and Black & Decker. In addition to the CRAFTSMAN offerings just highlighted, the DEWALT pruning saw and String Trimmer were awarded as Best for Contractors and the Black & Decker pruning chainsaw was named best for light duty use. This is a great recognition of the quality of the innovation we bring to the market and our ability to serve our entire user base from the consumer to the most demanding pro.
Don Allan	President & Chief Executive Officer at Stanley Black & Decker	Let me now turn the call over to Pat for some further financial highlights on the quarter and our latest outlets.
Patrick Hallinan	Executive Vice President & Chief Financial Officer at Stanley Black & Decker	Thank you, Don, and good morning everyone. I'm honored to join Stanley Black & Decker, the worldwide leader in Tools & Outdoor, at such a pivotal moment in the company's history. I have tremendous respect for the leadership team and Stanley Black & Decker's iconic portfolio of professional and consumer brands. During my initial weeks, I have been impressed with the breadth and depth of the company-wide transformation underway. Observing the early traction of the multi-year program and the savings captured during the initial phases, it is clear that the company's transformation is progressing rapidly and powerfully. I am energized to help accelerate the company's journey forward and to enhance our long legacy of market leading innovation and profit performance.
Patrick Hallinan	Executive Vice President & Chief Financial Officer at Stanley Black & Decker	Now let me walk through the details of the company's progress towards reducing inventory and improving gross margins. We exited last year with $5.9 billion of inventory. We reduced his by over $200 million in the first quarter. Since mid-2022, we have successfully reduced inventory by approximately $1 billion. This achievement was driven by improved supply chain conditions and planned production curtailments instituted during the back half of 2022 and which continue today. The targeted inventory reduction helped minimize the magnitude of the seasonal working capital build typical of our first quarter. As a frame of reference, our first quarter working capital build has averaged $700 million over the last five years, while this quarter it was $200 million, improving our cash performance primarily via inventory reduction. We are on track to achieve our expected $500 million of first half inventory reduction as we work down raw material and component inventory while selling out finished goods. Our full year 2023 inventory reduction target remains $750 million to $1 billion to drive significant cash flow generation and to pay down debt, strengthen our balance sheet, and back our long-standing commitment to return value to shareholders through cash dividends. Overall, the pace of our inventory reduction will be demand dependent and in a few moments I will cover the range of demand scenarios we are considering within our 2023 guidance.
Patrick Hallinan	Executive Vice President & Chief Financial Officer at Stanley Black & Decker	Turning to gross margins, which are also improving in a manner consistent with our plan. First quarter adjusted gross margins were approximately 23%, up 360 basis points sequentially versus the fourth quarter 2022, as we saw a smaller headwind from destocking actions and as our transformation initiatives provide a greater income statement benefit, something we expect to continue. Production containments in the first quarter were at levels relatively similar to those of the back half of last year and the destock impacted gross margin by approximately 400 to 500 basis points. We expect a similar impact to the second quarter resulting in second quarter adjusted gross margin consistent with that of the first quarter. Our base case guidance anticipates the adverse margin impact from our targeted production curtailments and destocking will ease through the year. Supporting adjusted gross margin expansion into the mid-to-high 20s for the second half of the year. The timing of normalized production and improved gross margin could shift earlier or later depending on the demand environment and corresponding speed of inventory reduction.
Patrick Hallinan	Executive Vice President & Chief Financial Officer at Stanley Black & Decker	We will actively monitor demand and adjust our supply chain to optimize the pace of margin improvement and inventory reduction throughout 2023. An important leading indicator for gross margin is the 110 million of supply chain transformation savings delivered in the first quarter. As these savings turn through inventory later this year, gross margin will expand further. It is encouraging to see the initial progress towards our multi-year target to return adjusted gross margins to the 35 plus percent range. We are prioritizing cash generation, gross margin improvement, and balance sheet strength. By executing against these priorities, we are positioning the company for long-term growth and value creation.
Patrick Hallinan	Executive Vice President & Chief Financial Officer at Stanley Black & Decker	Now turning to 2023 guidance. We are reiterating our four-year adjusted earnings per share guidance range of $0 to $2 per share. On a GAAP basis, we expect the earnings range per share to be negative $1.65 to $0.60, inclusive of one-time charges primarily from the global supply chain transformation and outdoor integration. The current pre-tax charges estimate was narrowed to 275 to 325 million with approximately 25% of these expenses being non-cash. We continue to target free cash flow generation of $500 million to $1 billion, primarily driven by inventory reduction. Consistent with the framework shared in February, we planned and continue to forecast around three 2023 demand scenarios as the macroeconomic outlook remains dynamic. Our base case scenario assumes a modestly unfavorable market demand environment compared to what we experienced during the second half of last year. In this scenario, we are assuming total organic growth to be down low to mid-single-digit, incorporating the softer start to the outdoor season. Tools & Outdoor, total organic revenue is expected to be down low to mid-single-digit, while we expect low single-digit growth for industrial. The base case also assumes that we maintain the production curtailment with the intention to return to normalized production levels during the third quarter.
Patrick Hallinan	Executive Vice President & Chief Financial Officer at Stanley Black & Decker	As a result, the under-absorption of fixed manufacturing costs would continue to constrain second quarter operating margins to low single-digit. As production returns to normalized levels in the back half of the year, we expect operating margin to improve to the mid-to-high single-digit range, resulting in full-year operating margins in the mid-single-digit. Finally, the base case includes approximately 125 million of annualized reinvestment targeting Tools & Outdoor growth acceleration and complexity reduction. We plan to be measured with the magnitude and timing of such investments depending on the demand environment. The second half acceleration scenario contemplates a stronger demand environment, supporting organic growth in the second half of 2023. In this scenario, we would expect a quicker normalization of inventory levels and gross margin improvement. Total organic growth would be relatively flat for the year. This scenario would position the company to deliver high single-digit operating margins in the second half, as well as a larger level of reinvestment to accelerate our transformation. The downside case reflects a deceleration of demand due to elevated recessionary pressures. If this scenario becomes the macro reality, we would expect full-year organic revenues to decline by mid-single-digit, with volume declines in both the Tools & Outdoor and industrial segments.
Patrick Hallinan	Executive Vice President & Chief Financial Officer at Stanley Black & Decker	In this scenario, production curtailments would likely remain in place through the end of 2023, extending the timeline of our gross margin recovery. With lower demand, we would adjust the level of reinvestment in capex until we have more clarity on the extent and duration of the macro impacts. We believe it is prudent to maintain these ranges of 2023 demand outcomes, production levels, and approaches to reinvestment as we prioritize our transformation and inventory reduction and cash generation.
