Speaker	Title	Content
Patrick Hallinan	Executive Vice President & Chief Financial Officer at Stanley Black & Decker	Turning to important remaining elements of guidance, for the full year, we expect the below-the-line expenses in total to be relatively similar to the guidance issued in early February. We are building an expectation for higher interest expense, which is offset by a modestly lower 2023 tax expense assumption. For the second quarter, we are expecting a sequential improvement in operating profit, primarily from seasonally higher levels of revenue. Adjusted gross margin is planned to be in the low 20s, relatively similar to that of the first quarter. Adjusted EPS is planned to be at a loss of approximately $0.40 per share at the midpoint, incorporating an expectation for a higher tax expense versus the first quarter.
Patrick Hallinan	Executive Vice President & Chief Financial Officer at Stanley Black & Decker	Free cash flow is expected to be positive in the second quarter, primarily from inventory reduction. Our plan calls for earnings to inflect positively in the second half of the year, generating an annualized EBITDA run rate of approximately $1.3 to $1.7 billion. This range is similar to our view in February, and we believe this is the appropriate base to build off as we deliver our transformation savings over the next couple of years. We are planning for the dynamic operating environment to continue, and feel we have the strategy in place to successfully navigate our path forward as we remain focused on driving above-market, long-term organic growth and margin expansion.
Patrick Hallinan	Executive Vice President & Chief Financial Officer at Stanley Black & Decker	With that, I will now turn the call back over to Don.
Don Allan	President & Chief Executive Officer at Stanley Black & Decker	Thank you, Pat. We are continuing to forge our path forward. We made solid progress again in the first quarter with strong cost savings, inventory reduction, and advancements across all elements of the transformation plan. As we execute against our strategy in 2023, and over the three-year time horizon, we believe our transformation efforts will begin to drive more material financial benefits.
Don Allan	President & Chief Executive Officer at Stanley Black & Decker	Our focus will be to continue to reinvest $300 million to $500 million of these benefits toward faster growth as we strengthen the innovation machine and stimulate demand with enhanced end-user activation. We believe our actions to reshape, focus, and streamline our organization, as well as reinvest in our core businesses, will enable us to deliver strong shareholder value over the long-term via robust organic growth and enhanced profitability. We have the best people, the best brands, and the most powerful innovation engine in our industry.
Don Allan	President & Chief Executive Officer at Stanley Black & Decker	Combine this with the passion, energy, and commitment I see across the organization every day, and it gives me great confidence that we will focus on what we can control to be successful, and we ultimately will recreate a significant market share gaining machine.
Don Allan	President & Chief Executive Officer at Stanley Black & Decker	With that, we are now ready for Q&A. Dennis?
Dennis Lange	Vice President-Investor Relations at Stanley Black & Decker	Great. Thanks, Don. Shannon, we can now start Q&A, please. Thank you.
Operator	Operator	Thank you. [Operator Instructions] Our first question comes from the line of Nigel Coe with Wolfe Research. Your line is now open.
Nigel Coe	Analyst at Wolfe Research	Thanks. Good morning, everyone.
Don Allan	President & Chief Executive Officer at Stanley Black & Decker	Good morning.
Nigel Coe	Analyst at Wolfe Research	Good morning, and Pat, look forward to meeting you soon, and Don, congratulations on hiring Chris Nelson. He's someone we know really well, so good guy.
Don Allan	President & Chief Executive Officer at Stanley Black & Decker	Thank you.
Nigel Coe	Analyst at Wolfe Research	So my question is really just -- maybe just more detail on the Tools & Storage sales in North America. You talked about footprint of sales being above 2019 levels, but just wondering how that looked year-over-year, maybe the fact the Pro and DIY.
Nigel Coe	Analyst at Wolfe Research	And then the pricing of 2%. To what extent was that a lot of promotional activity around maybe outdoor? And how do you see pricing trending through the year? Thanks.
Don Allan	President & Chief Executive Officer at Stanley Black & Decker	Yes, I'll give a little color on POS, and then ask Pat to give a little color on the pricing part of the question. So I, the POS trends are obviously, when you look at them year-over-year, for some of our customers, they're down in the mid-single digits to high-single digits. Other customers are only down in the low-single digits to flat. So you got a mixed bag of different things happening there, but overall, we are seeing, POS down year-over-year in Q1, and that trend will likely continue in Q2 at a lesser magnitude because as the comp gets easier from Q1 to Q2, that trend will continue.
Don Allan	President & Chief Executive Officer at Stanley Black & Decker	The trend around PRO continues to be very healthy. We're not seeing any major shifts in that dynamic. The consumer side continues to be relatively flat sequentially to what we've been experiencing for the last, two or three quarters since the second quarter of last year. No major shifts there, but certainly not any strengthening on the consumer side as people continue to shift their dollars to different areas across the United States.
Don Allan	President & Chief Executive Officer at Stanley Black & Decker	But overall, I would say POS is kind of trending the way we would expect. Outdoor is a little choppy in the last six to eight weeks, as we saw a pretty rough March due to the weather. Things got better first half to the later stages of April as the weather got better, and then obviously we've seen a little bit of bumpiness in the last week or so as the weather hasn't been great in the Midwest and New England and Northeast in that time frame. And not to be a weather forecaster, but the weather is looking much better as we go into next week, so hopefully that trend shifts back to a positive. But it's a little bit of choppiness.
Don Allan	President & Chief Executive Officer at Stanley Black & Decker	I think, all of us, the retailers, our customers, ourselves, are all looking at probably the next month or so as to what the trends will be in POS, and that will really ultimately define the success of the season. But I do think we've factored our guidance in a way that allows us to navigate that effectively. And, Pat, maybe a little color on price now.
Patrick Hallinan	Executive Vice President & Chief Financial Officer at Stanley Black & Decker	Pricing environment has been stable. The price increase dynamic for us that you referenced in the first quarter was largely a carry-in price increase. Broadly in the channels and across competitors, the pricing environment remains stable. It appears to us that most in the market are focused on margin enhancement and, therefore, preserving pricing. We don't expect additional price in our outlook through the balance of the year, so stable pricing. We will be, given the supply chain improvements we've been making, we will be engaging in traditional seasonal promotions throughout the year, so that dynamic will be returning, but that's less of a new pricing dynamic and more of a return to traditional seasonal promotions.
Operator	Operator	Thank you. Our next question comes from the line of Julian Mitchell with Barclays. Your line is now open.
Julian Mitchell	Analyst at Barclays	Thanks very much. Maybe just my question would be around, when you think about that uplift of margins from sort of low single digits amid the high single digits in the second half, maybe try to parse out how much of that is sort of sales uplift versus less destock versus less underproduction, and how we think about the phasing of third quarter versus fourth quarter earnings, anything major to call out there?
Don Allan	President & Chief Executive Officer at Stanley Black & Decker	Yes. Most of that margin uplift from the first half to the second half is driven by gross profit margin uplift as opposed to some particularly strong volume or SG&A component, and most of it is, as we get into the back half of the year, you'll have more of the progress and the transformation going through the income statement and less of the inventory destock and production curtailment providing headwinds in that. And the order of magnitude is in the 300 to 500 basis points of gross margin improvement first half to back half.
Operator	Operator	Thank you. Our next question comes from the line of Tim Wojs with Baird. Your line is now open.
Tim Wojs	Analyst at Robert W. Baird	Hey. Good morning, everybody, and welcome Pat. Maybe just on the channels, I guess, what do you -- it sounds like you've got kind of varying levels of kind of POS activity between your customers. I mean, how does that kind of translate into channel inventory and kind of what they're holding and kind of what their comfort of, you know, current channel inventory is looking like?
Don Allan	President & Chief Executive Officer at Stanley Black & Decker	Yes. Thanks for asking that question, Tim, because I didn't really get into that when I was talking about POS. But, yes, I would say the inventory levels in the channels and our major customers in North America and Europe are still high when you kind of look at traditional historical levels of inventory, but they are starting to come down. And so we're starting to see improvement in that. And I think for us in particular, the good news has always been that we weren't starting with a high level of inventory compared to maybe other folks within the industry and other competitors. So when you look at Home Depot as an example, we're not far away from where you would traditionally see. We're within a week or so of what we would typically want it to be and what they would want it to be. Lowe's is a little bit higher than that, but Lowe's tends to run at a much higher level of inventory, as we all know, versus Home Depot, so we feel pretty good about it. I think you'll see a continued little bit of working down of our inventory and our customers in Q2 and maybe a little bit of that in the Q3 as we work through the year, depending on where demand goes. So I don't think we're done with the destocking, but I think it's something that's very manageable for us versus maybe what some of our competitors are dealing with right now.
Operator	Operator	Thank you. Our next question comes from the line of Josh Pokrzywinski with Morgan Stanley. Your line is now open.
Josh Pokrzywinski	Analyst at Morgan Stanley	Hi, good morning, guys.
Don Allan	President & Chief Executive Officer at Stanley Black & Decker	Morning.
Josh Pokrzywinski	Analyst at Morgan Stanley	So, Don, I just want to maybe follow up on the SKU reduction. So for what you guys have contemplated and maybe what you've done so far, what has been the drag on organic growth? I guess how much of that drops through to, you know, just kind of, you know, shelf space loss, etcetera, versus something you can backfill with similar products?
Don Allan	President & Chief Executive Officer at Stanley Black & Decker	Yes, that's a good question for me to clarify. Thank you for asking that. So we're being very thoughtful on how we do this. And so those 60,000 SKUs is a lot of SKUs. When you hear about that, you start to wonder if that's going to have an impact on revenue. But the ones that we've eliminated in the first phase really had, very little revenue tied to them and very little inventory in the system. So, it was really just eliminating something that hasn't really been selling over the last several years. What you're left with now are the ones that, which is about 45,000 SKUs, that we stopped manufacturing, there's revenue tied to that, and there's inventory in our system tied to it as well.
Don Allan	President & Chief Executive Officer at Stanley Black & Decker	And so, you need to go through a thoughtful process with all of our customers of conversion from those products to other products that exist in Stanley Black & Decker that are very similar in nature. Now, whether that's an upgraded version that has been upgraded through innovation and the customer is still selling the older version, it could be an example of that. It could be an example of a brand being sold under a certain product and that we want to switch that brand over in that particular customer to a similar product but a different brand. And that takes probably 12 to 18 months to navigate through. And so, it's going to be a very slow methodical process with the overall objective being to not have an impact on revenue and to really minimize any potential write-outs that might exist in the world of inventory. And so far, the team has been very successful in doing that, but there's still a lot of work ahead of us. And we have dedicated resources that are focused on this within our tools and outdoor business. And they have a very good grasp of the commercial aspects of this as well as supply chain. And I think they're doing an effective job so far navigating through it. Thank you. Our next question comes from the line of Michael Rehaut with JPMorgan. Your line is now open.
Michael Rehaut	Analyst at JPMorgan Chase & Co.	Thanks. Good morning, everyone. And Pat, welcome and nice to see you again, so to speak. First, well, I guess my only question; I wanted to get a sense of maybe if I can kind of break it into two parts, actually. One is just a clarification on the first quarter results. What drove the upside on the operating margins? I believe you're looking for something more flattish to 4Q. But then secondly, on the guidance, you talked about PRO remaining healthy. I was just curious in terms of how you're thinking about PRO, particularly in the back half. And when you think about tools and storage with the guidance in the base case, if that is looking for a positive inflection or just being more flat, and how PRO figures in that?
Patrick Hallinan	Executive Vice President & Chief Financial Officer at Stanley Black & Decker	Yes, Mike, thanks for the question. In terms of the first quarter favorability, we are executing well on the transformation. And so the transformation is running ahead of plan. And we're feeling good, not just about 2023, but about the road beyond 2023 and delivering on that transformation. So I would say just, when you get to the phasing of it throughout the year, that's more just it's difficult to predict perfectly how inventory rolls off your balance sheet and what level of inventory rolls off your balance sheet. So I would say having guidance that's highly consistent with the original guidance of low 20% gross profit margins in the first half and high 20% gross profit margins in the back half is the way you should think of the business. You should have confidence in the transformation delivering that. And the way it flows quarter to quarter is always going to depend a little bit on mix and what type of inventory is coming off the balance sheet. So I wouldn't subscribe anything other than that to the first half gross profit margin. Solid transformation performance and just an update on where the inventory is falling off the balance sheet. In terms of the outlook of the end market dynamics in Tools & Outdoor for the balance of the year, we would expect what we've seen in the first quarter to persist throughout the balance of the year, which is continued strength in the pro-environment and a softer consumer environment and that dynamic to be relatively consistent across the quarters but as Don mentioned earlier, Q&A, the comp gets easier as we get from the second quarter to the third quarter. So it's less about a change in end market buyer behavior in the last three quarters of the year, and it's more the comp easing in the latter part of the year.
Operator	Operator	Thank you. Our next question comes from the line of Chris Snyder with UBS. Your line is now open.
Chris Snyder	Analyst at UBS Group	Thank you. So the Q1 inventory reduction certainly seems to be tracking ahead of expectations. But you guys left the 1 HD stock guide unchanged at 500 million. Does this signal that maybe some of the destock was pulled forward into Q1? Or should we think about potential upside on the rate of the first half destock? Because it does sound like outdoor is improving in April relative to March. Thank you.
Patrick Hallinan	Executive Vice President & Chief Financial Officer at Stanley Black & Decker	Yes, I'd start by reiterating that, we're committed to destocking 750 million to a billion for the year. And that's the commitment. And the team is working through that, given a dynamic macro environment. The reason to not change the flow throughout the first half and the second half is really, channels remain conservative as you would expect with a dynamic macro environment and relatively high short-term borrowing costs. And so, we'll continue to navigate the same environment that they're facing and achieve the year. But right now, it's just too soon to change our outlook on the first half and the second year, second half inventory changes.
Operator	Operator	Thank you. Our next question comes from the line of Eric Bosshard with Cleveland Research. Your line is now open.
Eric Bosshard	Analyst at Cleveland Research	Thanks. Good morning. Patrick, I hear the guidance on the 750 to a billion. I'm curious as you think about solving that in an environment where retail inventories are a little bit heavy. The demand is where it is. I'm curious as you think about promotions and really working through your inventory into an environment where things are slow and the inventories are a bit heavy. Is there a desire to be patient in the pace at which you work through that inventory? Or is there an opportunity to be more aggressive through promotions to clear out that inventory through 2023 to be better positioned for 2024? How do you navigate or solve through that dynamic?
Patrick Hallinan	Executive Vice President & Chief Financial Officer at Stanley Black & Decker	Now, thanks for the question, Eric. Our inclination is to be more thoughtful around sales and operations planning. It is not our intent, except for around the SKU rationalization areas, it's not our intent to drive an inventory change through aggressive pricing. That is not our intent. We're going to be disciplined on pricing and we're going to be focused on improving margins throughout 2023 and beyond 2023. So we'll be addressing that, Eric, really by internal planning around production relative to sales and we'll update, the guidance as appropriate as the macro unfolds and as channel behavior unfolds.
Operator	Operator	Thank you. This concludes the question-and-answer session. I would now like to hand the call back over to Dennis Lange for closing remarks.
Dennis Lange	Vice President-Investor Relations at Stanley Black & Decker	Thanks, Shannon. We'd like to thank everyone again for their time and participation on the call. Obviously, please contact me if you have any further questions. Thank you.
Operator	Operator	[Operator Closing Remarks]
